{
  "id": "openai/gpt-4o#1",
  "provider": "openai",
  "model": "gpt-4o",
  "version": 1,
  "effective_from": "2026-01-01T00:00:00Z",
  "rates": {
    "input": { "per_token": 0.0000025 },
    "output": { "per_token": 0.00001 },
    "cache_read": { "per_token": 0.00000125, "reduces": "input" }
  },
  "tiers": [],
  "source": "default",
  "created_at": "2026-07-11T00:00:00Z"
}
